{
  "report_schema_version": "0.1",
  "candidate": { "name": "App B (dirset fixture)", "pna_spec_version": "0.1", "picks_source": "inferred" },
  "summary": { "posture": "non-conformant", "headline": "Second report in a two-report directory fixture." },
  "findings": [
    { "ac_id": "AC-1", "status": "non-conformant", "goals": [1],
      "requirement": "Private data MUST NOT leave the device on its own.",
      "citations": [{ "path": "b/sync.js", "lines": "10", "note": "posts to a remote endpoint" }] }
  ]
}
