{
  "report_schema_version": "0.1",
  "generated_at": "2026-06-08T00:00:00Z",
  "generated_by": "pna-toolkit skill (illustrative sample modeled on fellows_local_db — not its live attestation)",
  "candidate": {
    "name": "fellows_local_db (illustrative — see reference_designs/fellows_local_db for the real attestation)",
    "repo_url": "https://github.com/richbodo/fellows_local_db",
    "commit": "0000000000000000000000000000000000000000",
    "pna_spec_version": "0.1",
    "picks_source": "declared",
    "axis_picks": {
      "distribution": "web-bundle-with-magic-link",
      "storage": "opfs-sqlite-wasm",
      "ingestion": "single-source-static-mirror",
      "workspace-shell": "vanilla-js-spa",
      "comms": "mailto-only",
      "mcp-exposure": "shared+private+comms"
    }
  },
  "summary": {
    "posture": "mixed",
    "headline": "Conformant where it counts: the cloud-LLM path is handled as a declared EX-CLOUD-LLM exception (AC-MCP-A), and the off-folder durability ceiling (CST-PWA-PRIVATE-SNAPSHOT) is honestly capability-reduced at the data layer (AC-1; the durability ceiling bounds Goal 4). One MCP bulk-confirmation question is left for human review.",
    "leading_concerns": []
  },
  "findings": [
    {
      "ac_id": "AC-MCP-A",
      "ac_source": "universal",
      "status": "conformant",
      "goals": [2, 3],
      "citations": [
        { "path": "app/static/app.js", "note": "install-time consent gate (recordMcpbConsent) + a persistent 'not a PNA right now' banner" },
        { "path": "mcp_servers/private_data_ops.py", "note": "the data-ops servers open both DBs mode=ro" }
      ],
      "evidence": [
        { "source": "human", "detail": "Maintainer review: cloud access is mediated by the EX-CLOUD-LLM exception handler (EX-H1 through EX-H8) — consent before the raise, a persistent non-PNA-mode signal, a runtime explainer, and a return-to-PNA-mode control." },
        { "source": "llm", "detail": "Traced the consent path: a cloud client cannot reach Private DB rows without the workspace-side opt-in. EX-H7 (consent-to-human propagation) is best-effort via the MCP instructions handshake — an honest, attested gap, not over-claimed." }
      ]
    },
    {
      "ac_id": "AC-1",
      "ac_source": "universal",
      "status": "conformant",
      "goals": [1, 3],
      "citations": [
        { "path": "app/static/vendor/sqlite-worker.js", "note": "_refuseDurablePrivateWriteOffFolder guards every mutation at the worker/data layer (not UI-only)" }
      ],
      "evidence": [
        { "source": "deterministic", "tool": "egress-lint", "detail": "No off-device egress vectors for private data; the allow-list covers only the magic-link auth origin." },
        { "source": "human", "detail": "CST-PWA-PRIVATE-SNAPSHOT is handled honestly: off Chromium the design refuses durable private writes at the data layer and says so, rather than promising a durable store it cannot keep (no false durability)." }
      ]
    },
    {
      "ac_id": "AC-MCP-B",
      "ac_source": "universal",
      "status": "unable-to-determine",
      "goals": [3],
      "rationale": "The Communications MCP tool stages a mailto: URL rather than firing a transport (good), but whether every workspace path that launches it re-confirms the payload under all bulk-send flows could not be confirmed from the source alone — flagging for a human to exercise the bulk-send UI.",
      "needs_human_review": true
    }
  ]
}
